{
  "$schema": "https://json-schema.org/draft/2020-12/schema",
  "$id": "https://joopererer.github.io/provenance-spec/schema/0.1/provenance.schema.json",
  "title": "Provenance Metadata 0.1 (JSON representation)",
  "type": "object",
  "required": [
    "schema",
    "assetId",
    "capturedAt",
    "capturedBy"
  ],
  "properties": {
    "schema": {
      "type": "string",
      "pattern": "^\\d+\\.\\d+$"
    },
    "assetId": {
      "type": "string",
      "pattern": "^[0-9a-f]{8}-[0-9a-f]{4}-4[0-9a-f]{3}-[89ab][0-9a-f]{3}-[0-9a-f]{12}$"
    },
    "capturedAt": {
      "type": "string",
      "pattern": "^\\d{4}-\\d{2}-\\d{2}(T\\d{2}:\\d{2}(:\\d{2}(\\.\\d+)?)?(Z|[+-]\\d{2}:\\d{2}))?$"
    },
    "capturedBy": {
      "type": "string",
      "minLength": 1
    },
    "metadataDate": {
      "type": "string",
      "pattern": "^\\d{4}-\\d{2}-\\d{2}(T\\d{2}:\\d{2}(:\\d{2}(\\.\\d+)?)?(Z|[+-]\\d{2}:\\d{2}))?$"
    },
    "source": {
      "type": [
        "object",
        "null"
      ],
      "required": [
        "platform"
      ],
      "properties": {
        "url": {
          "anyOf": [
            {
              "type": "string",
              "format": "uri"
            },
            {
              "type": "null"
            }
          ]
        },
        "platform": {
          "type": "string",
          "pattern": "^[a-z0-9_-]+$"
        },
        "id": {
          "type": [
            "string",
            "null"
          ]
        },
        "itemIndex": {
          "type": [
            "integer",
            "null"
          ],
          "minimum": 1
        },
        "itemCount": {
          "type": [
            "integer",
            "null"
          ],
          "minimum": 1
        },
        "authorId": {
          "type": [
            "string",
            "null"
          ]
        },
        "publishedAt": {
          "anyOf": [
            {
              "type": "string",
              "pattern": "^\\d{4}-\\d{2}-\\d{2}(T\\d{2}:\\d{2}(:\\d{2}(\\.\\d+)?)?(Z|[+-]\\d{2}:\\d{2}))?$"
            },
            {
              "type": "null"
            }
          ]
        },
        "pairId": {
          "type": [
            "string",
            "null"
          ]
        }
      },
      "additionalProperties": true
    },
    "title": {
      "type": [
        "string",
        "null"
      ]
    },
    "creator": {
      "type": [
        "array",
        "null"
      ],
      "items": {
        "type": "string"
      }
    },
    "description": {
      "type": [
        "string",
        "null"
      ],
      "maxLength": 2000
    },
    "subject": {
      "type": [
        "array",
        "null"
      ],
      "items": {
        "type": "string"
      }
    },
    "rating": {
      "type": [
        "integer",
        "null"
      ],
      "minimum": 0,
      "maximum": 5
    },
    "aiLabel": {
      "type": [
        "string",
        "null"
      ]
    },
    "aiLabelSource": {
      "type": [
        "string",
        "null"
      ],
      "enum": [
        "platform",
        "author",
        "unknown",
        null
      ]
    },
    "digitalSourceType": {
      "anyOf": [
        {
          "type": "string",
          "format": "uri"
        },
        {
          "type": "null"
        }
      ]
    }
  },
  "additionalProperties": true
}
