{
  "schema": "0.1",
  "assetId": "4a5b6c7d-8e9f-4a0b-8c2d-3e4f5a6b7c8d",
  "capturedAt": "2026-10-23T10:00:00+02:00",
  "capturedBy": "EasySave/1.8.0",
  "metadataDate": "2026-10-23T10:00:00+02:00",
  "source": {
    "url": "https://www.xiaohongshu.com/explore/6ad09b08000000000a024c55",
    "platform": "xiaohongshu",
    "id": "6ad09b08000000000a024c55",
    "authorId": "5f1a2b3c000000000100abcd",
    "publishedAt": "2026-10-22T18:00:00+08:00"
  },
  "title": "MP4 视频测试（含外来字段）",
  "creator": [
    "视频作者"
  ],
  "description": "测试 MP4 顶层 XMP uuid box 与外来命名空间字段保留",
  "subject": [
    "视频",
    "MP4"
  ],
  "rating": 5
}
