{
  "schema": "0.1",
  "assetId": "5b6c7d8e-9f0a-4b1c-8d3e-4f5a6b7c8d9e",
  "capturedAt": "2026-10-23T11:00:00+02:00",
  "capturedBy": "OnlineAlbumPlugin/2.4.0",
  "metadataDate": "2026-10-23T11:00:00+02:00",
  "source": {
    "url": "https://www.instagram.com/p/DbU8Jo5uP3-/",
    "platform": "instagram",
    "id": "DbU8Jo5uP3-"
  },
  "title": "QuickTime MOV 视频测试（moov 在末尾）",
  "creator": [
    "reels_creator"
  ],
  "description": "测试 MOV 格式下 moov atom 在末尾且含 XMP uuid box 的解析",
  "subject": [
    "Reels",
    "MOV"
  ],
  "rating": 4
}
