{
  "schema": "0.1",
  "assetId": "a1b2c3d4-e5f6-4a7b-8c9d-1e2f3a4b5c6d",
  "capturedAt": "2026-10-24T09:00:00+08:00",
  "capturedBy": "EasySave/1.9.0",
  "metadataDate": "2026-10-24T09:00:00+08:00",
  "source": {
    "url": "https://www.xiaohongshu.com/explore/6ad888880000000033021122",
    "platform": "xiaohongshu",
    "id": "6ad888880000000033021122",
    "itemIndex": 1,
    "itemCount": 1,
    "authorId": "5f1a2b3c000000000100abcd",
    "publishedAt": "2026-10-24T08:30:00+08:00"
  },
  "title": "AI 生成概念设计图",
  "creator": [
    "概念设计师"
  ],
  "description": "测试带 AI 标注的 JPEG 元数据与 IPTC DigitalSourceType 映射",
  "subject": [
    "AI",
    "概念设计"
  ],
  "rating": 5,
  "aiLabel": "内容疑似包含 AI 创作信息",
  "aiLabelSource": "platform",
  "digitalSourceType": "http://cv.iptc.org/newscodes/digitalsourcetype/compositeWithTrainedAlgorithmicMedia"
}
