{
  "schema": "0.1",
  "assetId": "6c7d8e9f-0a1b-4c2d-8e4f-5a6b7c8d9e0f",
  "capturedAt": "2026-10-23T12:00:00+02:00",
  "capturedBy": "FileOrganizer/2.1.0",
  "metadataDate": "2026-10-23T12:00:00+02:00",
  "title": "64位 Box 视频测试",
  "description": "测试支持 64 位长度（largesize）box 的跳过与解析",
  "subject": [
    "64bit",
    "MP4"
  ],
  "rating": 3
}
